{
    "blocking_issue_count":  0,
    "portfolio_decision":  "APPROVED",
    "portfolio_reasons":  [
                              "All three candidate skills (auditor-web, estratega-seo, maestro-frontend) satisfy canonical development requirements and pass all 12 evaluation gates with zero blocking issues.",
                              "Zero direct dependencies, zero direct scripts, and strict prohibition of silent dependency installation across all three skills.",
                              "Full alignment with PROXTEL local-first, no-auto-commit, no-auto-push, and no-auto-deploy controls, maintaining read-only audits and reversible implementation scopes.",
                              "Provider-neutral canonical design supporting Claude, Codex, and Antigravity with zero privilege requirements and zero secret exposure.",
                              "Byte-exact baseline preservation and deterministic test suite passes (M2 PASS, 78/78 candidate semantics, 8/8 official contracts)."
                          ],
    "promotion_eligible":  true,
    "required_actions":  [

                         ],
    "review_id":  "PROXTEL-AREA-1.7-M3-FIX1-DEVELOPMENT-PORTFOLIO-INDEPENDENT-AUDIT-V1",
    "skills":  [
                   {
                       "blocking_issues":  [

                                           ],
                       "decision":  "APPROVED",
                       "gates":  {
                                     "baseline":  "PASS",
                                     "dependencies":  "PASS",
                                     "evaluation":  "PASS",
                                     "holdout":  "PASS",
                                     "identity":  "PASS",
                                     "independent_review":  "PASS",
                                     "integrity":  "PASS",
                                     "license":  "PASS",
                                     "safe_to_execute":  "PASS",
                                     "sandbox":  "PASS",
                                     "semantic":  "PASS",
                                     "static_security":  "PASS"
                                 },
                       "id":  "auditor-web",
                       "promotion_eligible":  true,
                       "reasons":  [
                                       "Strict read-only default audit posture requiring verifiable evidence before any modification.",
                                       "Explicit prohibitions against file edits, dependency installs, and automatic commits or pushes during audits.",
                                       "Zero direct dependencies and zero direct scripts with read-only subprocess and filesystem declarations.",
                                       "Clear boundary conditions that forbid inventing metrics and protect against secret exposure."
                                   ],
                       "required_actions":  [

                                            ],
                       "risks":  [
                                     "Audit findings could be mistaken for exhaustive external security or compliance certifications; mitigated by explicit scope limits.",
                                     "Browser QA requires existing project support or authorized local environments; mitigated by discovery rules."
                                 ],
                       "strengths":  [
                                         "Evidence-based separation of verified facts, probable issues, and recommendations.",
                                         "Provider-neutral canonical specification with verified SHA-256 integrity and byte-exact legacy preservation.",
                                         "Strong boundaries preventing destructive browser actions and metric fabrication."
                                     ]
                   },
                   {
                       "blocking_issues":  [

                                           ],
                       "decision":  "APPROVED",
                       "gates":  {
                                     "baseline":  "PASS",
                                     "dependencies":  "PASS",
                                     "evaluation":  "PASS",
                                     "holdout":  "PASS",
                                     "identity":  "PASS",
                                     "independent_review":  "PASS",
                                     "integrity":  "PASS",
                                     "license":  "PASS",
                                     "safe_to_execute":  "PASS",
                                     "sandbox":  "PASS",
                                     "semantic":  "PASS",
                                     "static_security":  "PASS"
                                 },
                       "id":  "estratega-seo",
                       "promotion_eligible":  true,
                       "reasons":  [
                                       "Evidence-based technical and on-page SEO design preserving existing product, content, and branding.",
                                       "Explicit prohibition against promising rankings, unverified traffic projections, or inventing business data.",
                                       "Controlled implementation scope limited to authorized metadata, canonical tags, sitemaps, and structured data.",
                                       "Zero direct dependencies, zero direct scripts, and complete prohibition of silent dependency installation."
                                   ],
                       "required_actions":  [

                                            ],
                       "risks":  [
                                     "Potential stakeholder expectation of guaranteed search rankings; mitigated by explicit limitation declarations.",
                                     "Risk of altering approved commercial messaging during optimization; mitigated by content preservation rules."
                                 ],
                       "strengths":  [
                                         "Enforces rigorous syntax and coherence validation for structured data (Schema.org) and Open Graph tags.",
                                         "Integrates Core Web Vitals (LCP, INP, CLS) as technical SEO evidence when material.",
                                         "Distinguishes verifiable implementation facts from hypotheses and future outcomes."
                                     ]
                   },
                   {
                       "blocking_issues":  [

                                           ],
                       "decision":  "APPROVED",
                       "gates":  {
                                     "baseline":  "PASS",
                                     "dependencies":  "PASS",
                                     "evaluation":  "PASS",
                                     "holdout":  "PASS",
                                     "identity":  "PASS",
                                     "independent_review":  "PASS",
                                     "integrity":  "PASS",
                                     "license":  "PASS",
                                     "safe_to_execute":  "PASS",
                                     "sandbox":  "PASS",
                                     "semantic":  "PASS",
                                     "static_security":  "PASS"
                                 },
                       "id":  "maestro-frontend",
                       "promotion_eligible":  true,
                       "reasons":  [
                                       "Professional frontend architecture adhering strictly to existing stack, architecture, and client branding.",
                                       "Prohibits imposing generic aesthetics and preserves genuine project assets against silent replacement.",
                                       "Full alignment with PROXTEL local-first, no-auto-commit, no-auto-push, and no-auto-deploy controls.",
                                       "Justified motion and 3D policy requiring trade-off evaluation against bundle size, GPU, battery, and CWV."
                                   ],
                       "required_actions":  [

                                            ],
                       "risks":  [
                                     "Complex UI motion or 3D could degrade mobile performance or accessibility; mitigated by mandatory CWV and accessibility checks.",
                                     "Controlled filesystem deletion requires project authorization boundaries; enforced by security specifications."
                                 ],
                       "strengths":  [
                                         "Proportional validation criteria across responsive layouts, browser rendering, and build checks.",
                                         "Zero direct dependencies and zero direct scripts with explicit bans on silent production dependency installs.",
                                         "Clear lifecycle controls preventing automatic deployment or destructive production operations."
                                     ]
                   }
               ]
}